{
 "id": "apr-20261003T183801-51fb",
 "kind": "owner-info-tags",
 "title": "Owner information: PayHOA tags and request completions",
 "status": "applied",
 "scope": {
  "payhoa": true,
  "cycle": 2027
 },
 "profile": "example-village",
 "fingerprint": "f12f68bc95107ae48a4247a73ab578d6bd8a324fdb64e6aead6cc6ea4e418b59",
 "readAt": "2026-10-03T18:38:01+00:00",
 "requestedBy": "A Manager",
 "requestedAt": "2026-10-03T18:38:01+00:00",
 "requestedVia": "cli",
 "evidence": [
  {
   "label": "The same plan as a dry run",
   "address": "jason owner-info --apply --payhoa"
  },
  {
   "label": "Civil Code 4040, 4041",
   "address": "CIV 4041"
  },
  {
   "label": "The response policy's findings",
   "address": "jason owner-info --responses"
  }
 ],
 "items": [
  {
   "id": "7344a0e1a0d1efa6",
   "op": "member tag -",
   "target": "member:10",
   "label": "101 EXAMPLE WAY: Ana Example",
   "value": "Notices by Email",
   "why": "this cycle's answer (payhoa:501)",
   "group": "101 EXAMPLE WAY: Ana Example",
   "change": {
    "op": "remove",
    "field": "member tags",
    "value": "Notices by Email",
    "before": "Notices by Email",
    "after": "",
    "text": "- Notices by Email (member tags)"
   },
   "rule": "the response policy's delivery row (owner_responses.RULES: delivery)",
   "evidence": [
    {
     "label": "PayHOA request 501",
     "address": "payhoa:submission:501"
    }
   ],
   "basis": "4cd8072d3d4c7b2b49bc8218e77e4462c9236566a3b7826acecb5ffeaa791549",
   "class": "approvable",
   "boardItem": "",
   "dependsOn": [],
   "highStakes": false,
   "costCents": 0,
   "decision": "rejected",
   "decidedBy": "A Manager",
   "decidedAt": "2026-10-03T18:38:01+00:00",
   "reason": "next week",
   "result": "not_applied",
   "resultDetail": "rejected by A Manager: next week"
  },
  {
   "id": "ce429297c68875e6",
   "op": "member tag +",
   "target": "member:10",
   "label": "101 EXAMPLE WAY: Ana Example",
   "value": "Notices by Mail",
   "why": "this cycle's answer (payhoa:501)",
   "group": "101 EXAMPLE WAY: Ana Example",
   "change": {
    "op": "add",
    "field": "member tags",
    "value": "Notices by Mail",
    "before": "Notices by Email",
    "after": "Notices by Email, Notices by Mail",
    "text": "+ Notices by Mail (member tags)"
   },
   "rule": "the response policy's delivery row (owner_responses.RULES: delivery)",
   "evidence": [
    {
     "label": "PayHOA request 501",
     "address": "payhoa:submission:501"
    }
   ],
   "basis": "4cd8072d3d4c7b2b49bc8218e77e4462c9236566a3b7826acecb5ffeaa791549",
   "class": "approvable",
   "boardItem": "",
   "dependsOn": [],
   "highStakes": false,
   "costCents": 0,
   "decision": "rejected",
   "decidedBy": "A Manager",
   "decidedAt": "2026-10-03T18:38:01+00:00",
   "reason": "next week",
   "result": "not_applied",
   "resultDetail": "rejected by A Manager: next week"
  },
  {
   "id": "a6011a0ad7cbb357",
   "op": "member tag +",
   "target": "member:10",
   "label": "101 EXAMPLE WAY: Ana Example",
   "value": "Owner Info 2027",
   "why": "this cycle's answer (payhoa:501)",
   "group": "101 EXAMPLE WAY: Ana Example",
   "change": {
    "op": "add",
    "field": "member tags",
    "value": "Owner Info 2027",
    "before": "Notices by Email",
    "after": "Notices by Email, Owner Info 2027",
    "text": "+ Owner Info 2027 (member tags)"
   },
   "rule": "the response policy's delivery row (owner_responses.RULES: delivery)",
   "evidence": [
    {
     "label": "PayHOA request 501",
     "address": "payhoa:submission:501"
    }
   ],
   "basis": "4cd8072d3d4c7b2b49bc8218e77e4462c9236566a3b7826acecb5ffeaa791549",
   "class": "approvable",
   "boardItem": "",
   "dependsOn": [],
   "highStakes": false,
   "costCents": 0,
   "decision": "rejected",
   "decidedBy": "A Manager",
   "decidedAt": "2026-10-03T18:38:01+00:00",
   "reason": "next week",
   "result": "not_applied",
   "resultDetail": "rejected by A Manager: next week"
  },
  {
   "id": "dceffc0b8fac3f1d",
   "op": "member tag +",
   "target": "member:11",
   "label": "102 EXAMPLE WAY: Ben Sample",
   "value": "Notices by Email",
   "why": "this cycle's answer (payhoa:502)",
   "group": "102 EXAMPLE WAY: Ben Sample",
   "change": {
    "op": "add",
    "field": "member tags",
    "value": "Notices by Email",
    "before": "",
    "after": "Notices by Email",
    "text": "+ Notices by Email (member tags)"
   },
   "rule": "the response policy's delivery row (owner_responses.RULES: delivery)",
   "evidence": [
    {
     "label": "PayHOA request 502",
     "address": "payhoa:submission:502"
    }
   ],
   "basis": "5312b5da743162ecd8258388b655666c491d6f9aa33bc4a0d8561ab92834650c",
   "class": "approvable",
   "boardItem": "",
   "dependsOn": [],
   "highStakes": false,
   "costCents": 0,
   "decision": "approved",
   "decidedBy": "A Manager",
   "decidedAt": "2026-10-03T18:38:01+00:00",
   "reason": "",
   "result": "applied",
   "resultDetail": "written"
  },
  {
   "id": "79b0872b69c00a3f",
   "op": "member tag +",
   "target": "member:11",
   "label": "102 EXAMPLE WAY: Ben Sample",
   "value": "Owner Info 2027",
   "why": "this cycle's answer (payhoa:502)",
   "group": "102 EXAMPLE WAY: Ben Sample",
   "change": {
    "op": "add",
    "field": "member tags",
    "value": "Owner Info 2027",
    "before": "",
    "after": "Owner Info 2027",
    "text": "+ Owner Info 2027 (member tags)"
   },
   "rule": "the response policy's delivery row (owner_responses.RULES: delivery)",
   "evidence": [
    {
     "label": "PayHOA request 502",
     "address": "payhoa:submission:502"
    }
   ],
   "basis": "5312b5da743162ecd8258388b655666c491d6f9aa33bc4a0d8561ab92834650c",
   "class": "approvable",
   "boardItem": "",
   "dependsOn": [],
   "highStakes": false,
   "costCents": 0,
   "decision": "approved",
   "decidedBy": "A Manager",
   "decidedAt": "2026-10-03T18:38:01+00:00",
   "reason": "",
   "result": "applied",
   "resultDetail": "written"
  },
  {
   "id": "e956ce6be8a40eaf",
   "op": "member tag +",
   "target": "member:12",
   "label": "103 EXAMPLE WAY: Cy Placeholder",
   "value": "Notices by Email",
   "why": "this cycle's answer (payhoa:503)",
   "group": "103 EXAMPLE WAY: Cy Placeholder",
   "change": {
    "op": "add",
    "field": "member tags",
    "value": "Notices by Email",
    "before": "",
    "after": "Notices by Email",
    "text": "+ Notices by Email (member tags)"
   },
   "rule": "the response policy's delivery row (owner_responses.RULES: delivery)",
   "evidence": [
    {
     "label": "PayHOA request 503",
     "address": "payhoa:submission:503"
    }
   ],
   "basis": "7e129adb89490bbdf1a5f8a50ee05af5886717ac522a3b40f929fa96fe85a717",
   "class": "approvable",
   "boardItem": "",
   "dependsOn": [],
   "highStakes": false,
   "costCents": 0,
   "decision": "rejected",
   "decidedBy": "A Manager",
   "decidedAt": "2026-10-03T18:38:01+00:00",
   "reason": "next week",
   "result": "not_applied",
   "resultDetail": "rejected by A Manager: next week"
  },
  {
   "id": "9f524866de8c5727",
   "op": "member tag +",
   "target": "member:12",
   "label": "103 EXAMPLE WAY: Cy Placeholder",
   "value": "Owner Info 2027",
   "why": "this cycle's answer (payhoa:503)",
   "group": "103 EXAMPLE WAY: Cy Placeholder",
   "change": {
    "op": "add",
    "field": "member tags",
    "value": "Owner Info 2027",
    "before": "",
    "after": "Owner Info 2027",
    "text": "+ Owner Info 2027 (member tags)"
   },
   "rule": "the response policy's delivery row (owner_responses.RULES: delivery)",
   "evidence": [
    {
     "label": "PayHOA request 503",
     "address": "payhoa:submission:503"
    }
   ],
   "basis": "7e129adb89490bbdf1a5f8a50ee05af5886717ac522a3b40f929fa96fe85a717",
   "class": "approvable",
   "boardItem": "",
   "dependsOn": [],
   "highStakes": false,
   "costCents": 0,
   "decision": "rejected",
   "decidedBy": "A Manager",
   "decidedAt": "2026-10-03T18:38:01+00:00",
   "reason": "next week",
   "result": "not_applied",
   "resultDetail": "rejected by A Manager: next week"
  },
  {
   "id": "6f35931565f4e006",
   "op": "member tag +",
   "target": "member:13",
   "label": "104 EXAMPLE WAY: Dee Fictional",
   "value": "Notices by Email",
   "why": "this cycle's answer (payhoa:504)",
   "group": "104 EXAMPLE WAY: Dee Fictional",
   "change": {
    "op": "add",
    "field": "member tags",
    "value": "Notices by Email",
    "before": "",
    "after": "Notices by Email",
    "text": "+ Notices by Email (member tags)"
   },
   "rule": "the response policy's delivery row (owner_responses.RULES: delivery)",
   "evidence": [
    {
     "label": "PayHOA request 504",
     "address": "payhoa:submission:504"
    }
   ],
   "basis": "bd148e0e31d936744dbfa086efd271ceba1acecb86de7387725441b109d7de60",
   "class": "approvable",
   "boardItem": "",
   "dependsOn": [],
   "highStakes": false,
   "costCents": 0,
   "decision": "approved",
   "decidedBy": "A Manager",
   "decidedAt": "2026-10-03T18:38:01+00:00",
   "reason": "",
   "result": "applied",
   "resultDetail": "written"
  },
  {
   "id": "a0f145a0cdf5357c",
   "op": "member tag +",
   "target": "member:13",
   "label": "104 EXAMPLE WAY: Dee Fictional",
   "value": "Notices by Mail",
   "why": "this cycle's answer (payhoa:504)",
   "group": "104 EXAMPLE WAY: Dee Fictional",
   "change": {
    "op": "add",
    "field": "member tags",
    "value": "Notices by Mail",
    "before": "",
    "after": "Notices by Mail",
    "text": "+ Notices by Mail (member tags)"
   },
   "rule": "the response policy's delivery row (owner_responses.RULES: delivery)",
   "evidence": [
    {
     "label": "PayHOA request 504",
     "address": "payhoa:submission:504"
    }
   ],
   "basis": "bd148e0e31d936744dbfa086efd271ceba1acecb86de7387725441b109d7de60",
   "class": "approvable",
   "boardItem": "",
   "dependsOn": [],
   "highStakes": false,
   "costCents": 0,
   "decision": "approved",
   "decidedBy": "A Manager",
   "decidedAt": "2026-10-03T18:38:01+00:00",